{
  "version": "1.0.0",
  "generatedAt": "2025-11-18T07:22:01.378Z",
  "documentationHash": "c42ef847655b3e38aad9074ac4963a7f486c878eeae5a2eb13b9b5992b0c40eb",
  "resourceCount": 130,
  "toolCount": 10,
  "resources": [
    {
      "uri": "toss://docs/api/abis/overview",
      "name": "Smart Contract ABIs",
      "description": "Documentation for Smart Contract ABIs",
      "mimeType": "text/markdown",
      "contentHash": "6caa87b31dae645098c9fb72dc278bc8b4758bbe2394abadd5efb6380e79d91b",
      "lastModified": "2025-11-18T07:21:03.287Z",
      "size": 520,
      "category": "general",
      "tags": [
        "general",
        "risk"
      ]
    },
    {
      "uri": "toss://docs/api/overview",
      "name": "API Reference Overview",
      "description": "Documentation for API Reference Overview",
      "mimeType": "text/markdown",
      "contentHash": "47124ef449b5f9d9bf2204c48aaa6120ceaf8f816c5d109bb4e48d26d4a9ece0",
      "lastModified": "2025-11-18T07:21:03.287Z",
      "size": 3783,
      "category": "general",
      "tags": [
        "general",
        "risk",
        "fund"
      ]
    },
    {
      "uri": "toss://docs/api/rest/authentication",
      "name": "API Authentication",
      "description": "Documentation for API Authentication",
      "mimeType": "text/markdown",
      "contentHash": "13ccccb0878b1fea982ab675377c051bbf60e126d21d6e62babdbebf343f2153",
      "lastModified": "2025-11-18T07:21:03.288Z",
      "size": 396,
      "category": "general",
      "tags": [
        "general"
      ]
    },
    {
      "uri": "toss://docs/api/rest/introduction",
      "name": "REST API Introduction",
      "description": "Documentation for REST API Introduction",
      "mimeType": "text/markdown",
      "contentHash": "a9447d26a4e5dc5affbd36419fcd40f103a4e2d129028914206c4458f47b9154",
      "lastModified": "2025-11-18T07:21:03.288Z",
      "size": 1118,
      "category": "general",
      "tags": [
        "general",
        "governance",
        "fund"
      ]
    },
    {
      "uri": "toss://docs/api/rest/rate-limits",
      "name": "Rate Limits",
      "description": "Documentation for Rate Limits",
      "mimeType": "text/markdown",
      "contentHash": "4adde5c767c27629add0bf67f1fbcaf70efdc4aa5d72c26931ecd7c9893e189f",
      "lastModified": "2025-11-18T07:21:03.288Z",
      "size": 433,
      "category": "general",
      "tags": [
        "general"
      ]
    },
    {
      "uri": "toss://docs/api/sdk/overview",
      "name": "SDK Reference",
      "description": "Documentation for SDK Reference",
      "mimeType": "text/markdown",
      "contentHash": "513044d29e2da61fbd44ee9473bceaf189f7bb2f994874c82ed16f07af045ffb",
      "lastModified": "2025-11-18T07:21:03.287Z",
      "size": 547,
      "category": "general",
      "tags": [
        "general",
        "fund"
      ]
    },
    {
      "uri": "toss://docs/api/websocket/overview",
      "name": "WebSocket Events",
      "description": "Documentation for WebSocket Events",
      "mimeType": "text/markdown",
      "contentHash": "9daeb89dc0cb87ef4ce286df9ddb1988b35b40309d2b8d7708b7ab344688c8bf",
      "lastModified": "2025-11-18T07:21:03.287Z",
      "size": 384,
      "category": "general",
      "tags": [
        "general",
        "fund"
      ]
    },
    {
      "uri": "toss://docs/getting-started/first-fund",
      "name": "Creating Your First Fund",
      "description": "Documentation for Creating Your First Fund",
      "mimeType": "text/markdown",
      "contentHash": "1072f80a6d8881eeba24339a5cc82fc8043d3ec233f8847c977058b6162605b2",
      "lastModified": "2025-11-18T07:21:03.280Z",
      "size": 6496,
      "category": "general",
      "tags": [
        "general",
        "fund"
      ]
    },
    {
      "uri": "toss://docs/getting-started/installation",
      "name": "Installation",
      "description": "Documentation for Installation",
      "mimeType": "text/markdown",
      "contentHash": "b7774118a58414027ff792c8c82c73f4112e22603cb6cd860ac907296961b73d",
      "lastModified": "2025-11-18T07:21:03.281Z",
      "size": 3981,
      "category": "general",
      "tags": [
        "general",
        "fund"
      ]
    },
    {
      "uri": "toss://docs/getting-started/quick-start",
      "name": "Quick Start",
      "description": "Documentation for Quick Start",
      "mimeType": "text/markdown",
      "contentHash": "e09f5262c303ff376b55d466bfe4c6142a1ee2ea8f3145935b76084ff019933e",
      "lastModified": "2025-11-18T07:21:03.281Z",
      "size": 4125,
      "category": "general",
      "tags": [
        "general",
        "fund"
      ]
    },
    {
      "uri": "toss://docs/intro",
      "name": "Welcome to TOSS Protocol",
      "description": "Documentation for Welcome to TOSS Protocol",
      "mimeType": "text/markdown",
      "contentHash": "3ec10ac5d18f855632af7ad84f5db9e44df253e9454f6393c0460c616ac5e890",
      "lastModified": "2025-11-18T07:21:03.242Z",
      "size": 4917,
      "category": "general",
      "tags": [
        "general",
        "risk",
        "slashing",
        "governance",
        "zksync",
        "fund"
      ]
    },
    {
      "uri": "toss://docs/investor-deck/competitive-advantage",
      "name": "Competitive Advantage",
      "description": "Documentation for Competitive Advantage",
      "mimeType": "text/markdown",
      "contentHash": "932200728072728fd84a222a0f32811d5f49723f9e98722857bcd98e85da41ec",
      "lastModified": "2025-11-18T07:21:03.283Z",
      "size": 913,
      "category": "investor",
      "tags": [
        "investor",
        "risk",
        "zksync"
      ]
    },
    {
      "uri": "toss://docs/investor-deck/competitive-analysis",
      "name": "Competitive Analysis",
      "description": "Documentation for Competitive Analysis",
      "mimeType": "text/markdown",
      "contentHash": "0db9a1de8749ff7bbc241ff77429e06ec03b8edbbbcbfd66468c402b12294c4b",
      "lastModified": "2025-11-18T07:21:03.282Z",
      "size": 1161,
      "category": "investor",
      "tags": [
        "investor",
        "slashing",
        "zksync",
        "fund"
      ]
    },
    {
      "uri": "toss://docs/investor-deck/financials",
      "name": "Financial Projections",
      "description": "Documentation for Financial Projections",
      "mimeType": "text/markdown",
      "contentHash": "7df9ea398a9f99960c3ce6f5e470253377408d6a0f0e383aac1b9ca833621b6c",
      "lastModified": "2025-11-18T07:21:03.285Z",
      "size": 1701,
      "category": "investor",
      "tags": [
        "investor",
        "fund"
      ]
    },
    {
      "uri": "toss://docs/investor-deck/gtm-strategy",
      "name": "Go-to-Market Strategy",
      "description": "Documentation for Go-to-Market Strategy",
      "mimeType": "text/markdown",
      "contentHash": "bf04af7f869877a0532ab31e1012627fdeed51011a1a7460ebcd74206b560fac",
      "lastModified": "2025-11-18T07:21:03.282Z",
      "size": 1002,
      "category": "investor",
      "tags": [
        "investor",
        "fund"
      ]
    },
    {
      "uri": "toss://docs/investor-deck/investment-opportunity",
      "name": "Investment Opportunity",
      "description": "Documentation for Investment Opportunity",
      "mimeType": "text/markdown",
      "contentHash": "9277b000af890df81179ebd97e61379e72b1c937a98e18906c4af9a5c754c191",
      "lastModified": "2025-11-18T07:21:03.283Z",
      "size": 2876,
      "category": "investor",
      "tags": [
        "investor",
        "risk",
        "zksync",
        "fund"
      ]
    },
    {
      "uri": "toss://docs/investor-deck/market-size",
      "name": "Market Opportunity",
      "description": "Documentation for Market Opportunity",
      "mimeType": "text/markdown",
      "contentHash": "34302aaf584c6dab554cf5c801b2902c88cb569891cddef05a42d01f61646331",
      "lastModified": "2025-11-18T07:21:03.286Z",
      "size": 820,
      "category": "investor",
      "tags": [
        "investor",
        "fund"
      ]
    },
    {
      "uri": "toss://docs/investor-deck/platform-overview",
      "name": "Platform Overview",
      "description": "Documentation for Platform Overview",
      "mimeType": "text/markdown",
      "contentHash": "598f800fa5834f8d76b3e3de5bd6918e6c7fefdbca442276a6e2a9c266860cd9",
      "lastModified": "2025-11-18T07:21:03.284Z",
      "size": 1084,
      "category": "investor",
      "tags": [
        "investor",
        "risk",
        "zksync",
        "fund"
      ]
    },
    {
      "uri": "toss://docs/investor-deck/problem-statement",
      "name": "Problem Statement",
      "description": "Documentation for Problem Statement",
      "mimeType": "text/markdown",
      "contentHash": "48a1ba06ea867f286cd99e6daa6e1995464029902b8f54a3e3759a58aa000237",
      "lastModified": "2025-11-18T07:21:03.286Z",
      "size": 6919,
      "category": "investor",
      "tags": [
        "investor",
        "risk",
        "slashing",
        "zksync",
        "fund"
      ]
    },
    {
      "uri": "toss://docs/investor-deck/revenue-streams",
      "name": "Revenue Streams",
      "description": "Documentation for Revenue Streams",
      "mimeType": "text/markdown",
      "contentHash": "2ccc96d4d3a56e7b4758615fcd289817303bd70fe492732cdbeeb85c8d9867cf",
      "lastModified": "2025-11-18T07:21:03.286Z",
      "size": 770,
      "category": "investor",
      "tags": [
        "investor",
        "fund"
      ]
    },
    {
      "uri": "toss://docs/investor-deck/roadmap",
      "name": "Roadmap & Milestones",
      "description": "Documentation for Roadmap & Milestones",
      "mimeType": "text/markdown",
      "contentHash": "6e26d177c12ab4be3fccecabfb75690e8a47ed502f0a4bba011ba5f36030977e",
      "lastModified": "2025-11-18T07:21:03.282Z",
      "size": 1012,
      "category": "investor",
      "tags": [
        "investor",
        "zksync",
        "fund"
      ]
    },
    {
      "uri": "toss://docs/investor-deck/solution-overview",
      "name": "Solution Overview",